恌椕嬫暘,曐尟庬暿,恌 椕 峴 堊 柤 徧,揰悢扨壙 (揰),夞悢,憤揰悢 (揰)
弶恌,曐尟,弶恌椏,288揰,775,223丆200揰
弶恌,曐尟,奜棃姶愼懳嶔岦忋壛嶼乮弶恌乯,6揰,774,4丆644揰
弶恌,曐尟,栭娫丒憗挬摍壛嶼乮弶恌乯,50揰,76,3丆800揰
弶恌,曐尟,帪娫奜壛嶼乮弶恌乯,85揰,1,85揰
弶恌,曐尟,楢実嫮壔壛嶼乮弶恌乯,3揰,774,2丆322揰
嵞恌,曐尟,擇椶姶愼徢姵幰擖堾恌椕壛嶼乮揹榖摍嵞恌椏丒恌椕曬廣忋椪帪揑庢埖乯,250揰,8,2丆000揰
嵞恌,曐尟,嵞恌椏,73揰,738,53丆874揰
嵞恌,曐尟,摨擔嵞恌椏,73揰,2,146揰
嵞恌,曐尟,奜棃姶愼懳嶔岦忋壛嶼乮嵞恌乯,6揰,479,2丆874揰
嵞恌,曐尟,奜棃娗棟壛嶼,52揰,319,16丆588揰
嵞恌,曐尟,栭娫丒憗挬摍壛嶼乮嵞恌乯,50揰,79,3丆950揰
嵞恌,曐尟,柧嵶彂敪峴懱惂摍壛嶼,1揰,748,748揰
嵞恌,曐尟,楢実嫮壔壛嶼乮嵞恌乯,3揰,479,1丆437揰
嵞恌,曐尟,揹榖摍嵞恌椏,73揰,8,584揰
堛妛娗棟,曐尟,傾儗儖僊乕惈旲墛柶塽椕朄帯椕娗棟椏乮侾寧栚乯,280揰,12,3丆360揰
堛妛娗棟,曐尟,傾儗儖僊乕惈旲墛柶塽椕朄帯椕娗棟椏乮俀寧栚埲崀乯,25揰,55,1丆375揰
堛妛娗棟,曐尟,擕梒帣栭娫壛嶼乮彫帣壢嵞恌乯乮彫帣壢奜棃恌椕椏乯,65揰,25,1丆625揰
堛妛娗棟,曐尟,擕梒帣栭娫壛嶼乮彫帣壢弶恌乯乮彫帣壢奜棃恌椕椏乯,85揰,15,1丆275揰
堛妛娗棟,曐尟,擕梒帣帪娫奜壛嶼乮弶恌乯乮彫帣壢奜棃恌椕椏乯,85揰,1,85揰
堛妛娗棟,曐尟,擇椶姶愼徢姵幰擖堾恌椕壛嶼乮奜棃恌椕丒恌椕曬廣忋椪帪揑庢埖乯,250揰,225,56丆250揰
堛妛娗棟,曐尟,彎昦庤摉嬥堄尒彂岎晅椏,100揰,2,200揰
堛妛娗棟,曐尟,奜棃姶愼懳嶔岦忋壛嶼乮堛妛娗棟摍乯,6揰,308,1丆848揰
堛妛娗棟,帺旓,奜棃姶愼懳嶔岦忋壛嶼乮堛妛娗棟摍乯,6揰,2,12揰
堛妛娗棟,曐尟,彫帣峈嬠栻揔惓巊梡巟墖壛嶼乮彫帣壢奜棃恌椕椏乯,80揰,86,6丆880揰
堛妛娗棟,曐尟,彫帣壢奜棃恌椕椏乮張曽獬傪岎晅乯嵞恌帪,406揰,278,112丆868揰
堛妛娗棟,帺旓,彫帣壢奜棃恌椕椏乮張曽獬傪岎晅乯嵞恌帪,406揰,1,406揰
堛妛娗棟,曐尟,彫帣壢奜棃恌椕椏乮張曽獬傪岎晅乯弶恌帪,599揰,168,100丆632揰
堛妛娗棟,帺旓,彫帣壢奜棃恌椕椏乮張曽獬傪岎晅乯弶恌帪,599揰,1,599揰
堛妛娗棟,曐尟,摿掕幘姵椕梴娗棟椏乮恌椕強乯,225揰,7,1丆575揰
堛妛娗棟,曐尟,恌椕忣曬採嫙椏乮侾乯,250揰,26,6丆500揰
堛妛娗棟,曐尟,楢実嫮壔壛嶼乮堛妛娗棟摍乯,3揰,308,924揰
堛妛娗棟,帺旓,楢実嫮壔壛嶼乮堛妛娗棟摍乯,3揰,2,6揰
堛妛娗棟,曐尟,堾撪僩儕傾乕僕幚巤椏乮恌椕曬廣忋椪帪揑庢埖乯,300揰,227,68丆100揰
堛妛娗棟,曐尟,擄昦奜棃巜摫娗棟椏,270揰,4,1丆080揰
堛妛娗棟,曐尟,崅搙擄挳巜摫娗棟椏乮僀埲奜乯,420揰,5,2丆100揰
嵼戭,曐尟,嵼戭帩懕梲埑屇媧椕朄巜摫娗棟椏俀,250揰,8,2丆000揰
嵼戭,曐尟,嵼戭帩懕梲埑屇媧椕朄嵽椏壛嶼,100揰,8,800揰
嵼戭,曐尟,嵼戭帩懕梲埑屇媧椕朄梡帯椕婍壛嶼乮俠俹俙俹傪巊梡乯,1丆000揰,8,8丆000揰
搳栻,曐尟,堦斒柤張曽壛嶼侾乮張曽獬椏乯,7揰,357,2丆499揰
搳栻,曐尟,堦斒柤張曽壛嶼俀乮張曽獬椏乯,5揰,278,1丆390揰
搳栻,曐尟,張曽獬椏乮儕僼傿儖埲奜丒偦偺懠乯,68揰,1059,72丆012揰
搳栻,曐尟,摿掕幘姵張曽娗棟壛嶼侾乮張曽獬椏乯,18揰,8,144揰
搳栻,曐尟,摿掕幘姵張曽娗棟壛嶼俀乮張曽獬椏乯,66揰,7,462揰
拲幩,曐尟,揰揌拲幩乮偦偺懠乯乮擖堾奜乯,50揰,1,50揰
拲幩,曐尟,旂撪丄旂壓媦傃嬝擏撪拲幩,22揰,3,66揰
張抲,曐尟,暃旲峯愻忩乮偦偺懠乯乮曅乯,25揰,54,1丆350揰
張抲,曐尟,暃旲峯帺慠岥奐戝張抲,25揰,523,13丆075揰
張抲,曐尟,岥峯丄堲摢張抲,16揰,2,32揰
張抲,曐尟,帹張抲,27揰,211,5丆697揰
張抲,曐尟,帹岰愷嵡彍嫀乮暋嶨乯乮椉乯,180揰,109,19丆620揰
張抲,曐尟,帹岰愷嵡彍嫀乮暋嶨乯乮曅乯,100揰,34,3丆400揰
張抲,曐尟,帹娗張抲侾乮曅乯,36揰,8,288揰
張抲,曐尟,挻壒攇僱僽儔僀僓,24揰,386,9丆264揰
張抲,曐尟,屰幒張抲乮曅乯,55揰,16,880揰
張抲,曐尟,旲張抲,16揰,640,10丆240揰
張抲,曐尟,旲弌寣巭寣朄,240揰,3,720揰
庤弍,曐尟,僀僆儞僩僼僅儗乕僛壛嶼,45揰,3,135揰
庤弍,曐尟,奜帹摴堎暔彍嫀弍乮扨弮乯,260揰,6,1丆560揰
庤弍,曐尟,屰枌愗奐弍,830揰,3,2丆490揰
庤弍,曐尟,旲峯擲枌從庈弍,1丆080揰,14,15丆120揰
専嵏,曐尟,兞亅俧俿,11揰,4,44揰
専嵏,曐尟,僇儕僂儉,11揰,4,44揰
専嵏,曐尟,僋儗傾僠僯儞,11揰,4,44揰
専嵏,曐尟,僌儖僐乕僗,11揰,2,22揰
専嵏,曐尟,僠儞僷僲儊僩儕乕,340揰,34,11丆560揰
専嵏,曐尟,僫僩儕僂儉媦傃僋儘乕儖,11揰,4,44揰
専嵏,曐尟,僷儚乕丒儀僋僩儖暘愅壛嶼乮暯峵婡擻専嵏乯,200揰,30,6丆000揰
専嵏,曐尟,價僞儈儞俛侾俀,140揰,1,140揰
専嵏,曐尟,柶塽妛揑専嵏敾抐椏,144揰,78,11丆232揰
専嵏,曐尟,暯峵婡擻専嵏乮昗弨専嵏乯,20揰,62,1丆240揰
専嵏,曐尟,暯峵婡擻専嵏乮愒奜慄俠俠俢僇儊儔摍乯,300揰,43,12丆900揰
専嵏,曐尟,暯峵婡擻専嵏乮廳怱摦梙寁乯,250揰,30,7丆500揰
専嵏,曐尟,旝惗暔妛揑専嵏敾抐椏,150揰,9,1丆350揰
専嵏,曐尟,峈俽俽亅俙乛俼倧峈懱掕検,161揰,2,322揰
専嵏,曐尟,峈俽俽亅俛乛俴倎峈懱掕検,158揰,2,316揰
専嵏,曐尟,枛徑寣塼堦斒専嵏,21揰,5,105揰
専嵏,曐尟,枛徑寣塼憸乮帺摦婡夿朄乯,15揰,2,30揰
専嵏,曐尟,専嵏掽尭,-10亾,17,-995揰
専嵏,曐尟,昗弨弮壒挳椡専嵏,350揰,152,53丆200揰
専嵏,曐尟,摿堎揑俬倗俤敿掕検丒掕検,110揰,1004,41丆800揰
専嵏,曐尟,惗壔妛揑専嵏乮侾乯敾抐椏,144揰,5,720揰
専嵏,曐尟,娙堈挳椡専嵏乮婥摫弮壒挳椡乯,110揰,66,7丆260揰
専嵏,曐尟,嵶嬠攟梴摨掕専嵏乮偦偺懠乯,170揰,7,1丆190揰
専嵏,曐尟,嵶嬠栻嵻姶庴惈専嵏乮侾嬠庬乯,180揰,2,360揰
専嵏,曐尟,嵶嬠栻嵻姶庴惈専嵏乮俀嬠庬乯,230揰,2,460揰
専嵏,曐尟,廔栭悋柊億儕僌儔僼傿乕乮実懷梡憰抲巊梡乯,720揰,10,7丆200揰
専嵏,曐尟,帹柭専嵏,400揰,2,800揰
専嵏,曐尟,擼攇専嵏敾抐椏俀,180揰,10,1丆800揰
専嵏,曐尟,寣塼妛揑専嵏敾抐椏,125揰,5,625揰
専嵏,曐尟,挻壒攇専嵏乮抐憌嶣塭朄乯乮偦偺懠乯,350揰,20,7丆000揰
専嵏,曐尟,惷柆惈歬妎専嵏,45揰,6,270揰
専嵏,曐尟,旕摿堎揑俬倗俤掕検,100揰,26,2丆600揰
専嵏,曐尟,旲峯丒堲摢怈偄塼嵦庢,25揰,27,675揰
専嵏,曐尟,俙俴俹,11揰,2,22揰
専嵏,曐尟,俙俴俿,17揰,4,68揰
専嵏,曐尟,俙俽俿,17揰,4,68揰
専嵏,曐尟,俙倢倐乮俛俠俹夵椙朄丒俛俠俧朄乯,11揰,2,22揰
専嵏,曐尟,俙倣倷,11揰,4,44揰
専嵏,曐尟,俛亅俠,6揰,6,36揰
専嵏,曐尟,俛亅倁,37揰,31,1丆147揰
専嵏,曐尟,俛俬俴乛憤,11揰,2,22揰
専嵏,曐尟,俛倀俶,11揰,4,44揰
専嵏,曐尟,俠俫俆侽,38揰,2,76揰
専嵏,曐尟,俠俼俹,16揰,2,32揰
専嵏,曐尟,俠倛俤,11揰,2,22揰
専嵏,曐尟,俤俥亅岮摢,600揰,58,34丆800揰
専嵏,曐尟,俤俥亅歬楐丒旲堲峯丒暃旲峯,600揰,99,59丆400揰
専嵏,曐尟,俫俛們峈懱敿掕検丒掕検,133揰,1,133揰
専嵏,曐尟,俫俛倱峈懱,88揰,1,88揰
専嵏,曐尟,俫俛倱峈尨,88揰,1,88揰
専嵏,曐尟,俴俢,11揰,2,22揰
専嵏,曐尟,俼俥掕検,30揰,2,60揰
専嵏,曐尟,俽亅俵,64揰,7,448揰
専嵏,曐尟,俽俙俼俽亅俠倧倁亅俀峈尨専弌乮掕惈乯,300揰,43,12丆900揰
専嵏,曐尟,俽俙俼俽亅俠倧倁亅俀妀巁専弌乮専嵏埾戸埲奜乯,700揰,2,1丆400揰
専嵏,曐尟,俿俹,11揰,4,44揰
専嵏,曐尟,倀俙,11揰,2,22揰
専嵏,曐尟,倅値,136揰,1,136揰
夋憸,曐尟,僐儞僺儏乕僞乕抐憌恌抐,450揰,8,3丆600揰
夋憸,曐尟,扨弮嶣塭乮僀乯偺幨恀恌抐,85揰,1,85揰
夋憸,曐尟,扨弮嶣塭乮僨僕僞儖嶣塭乯,68揰,1,68揰
夋憸,曐尟,揹巕夋憸娗棟壛嶼乮僐儞僺儏乕僞乕抐憌恌抐椏乯,120揰,8,960揰
夋憸,曐尟,揹巕夋憸娗棟壛嶼乮扨弮嶣塭乯,57揰,1,57揰
夋憸,曐尟,俠俿嶣塭乮僀丄儘枖偼僴埲奜乯,560揰,8,4丆480揰
昦棟恌抐丒偦偺懠,曐尟,媬媫堛椕娗棟壛嶼侾乮恌椕曬廣忋椪帪揑庢埖乯乮俠俷倁丒奜棃恌椕乯,950揰,5,4丆750揰
曐尟奜旓梡,帺旓,岲巁媴惈暃旲峯墛偺椪彴挷嵏屄恖昜,1丆100墌,2,2丆200墌
曐尟奜旓梡,帺旓,曗憰嬶旓巟媼堄尒彂,3丆000墌,1,3丆000墌
曐尟奜旓梡,曐尟,恌嶡寯戙100墌,100墌,3,300墌
曐尟奜旓梡,曐尟,恌抐彂乮晛捠乯1000墌,1丆000墌,1,1丆000墌
曐尟奜旓梡,曐尟,恌抐彂乮惛枾乯3000墌,3丆000墌,1,3丆000墌
曐尟奜旓梡,帺旓,恌抐彂乮惛枾乯3000墌,3丆000墌,1,3丆000墌
崌寁,崌丂寁,揰悢崌寁,,,1丆158丆248揰
,,嬥妟崌寁,,,12丆500墌
